<?xml version="1.0" encoding="UTF-8"?>
<Excel xmlns="http://www.w3school.com.cn"
          xmlns:xsi="http://www.w3.org/2001/XMLSchema-instance"
          xsi:schemaLocation="http://www.w3school.com.cn excel.xsd">
    <Sheets>
        <Sheet sheetName="殷楠测试1" sheetOrder="0" classPath="com.songtech.ypoi.test.testModel.TestModel">
            <Titles>
                <title>
                    <titleName>标题</titleName>
                </title>
            </Titles>
            <Columns>
                <column>
                    <colName>test1</colName>
                    <fieldName>test1</fieldName>
                    <isImport>true</isImport>
                </column>
                <column>
                    <colName>test2</colName>
                    <fieldName>test2</fieldName>
                    <isImport>true</isImport>
                </column>
                <column>
                    <colName>test3</colName>
                    <fieldName>test3</fieldName>
                    <exportFormatter>YYYY-MM-DD</exportFormatter>
                    <isImport>true</isImport>
                </column>
                <column>
                    <colName>gogogo</colName>
                    <fieldName>gogogo</fieldName>
                    <orderNum>4</orderNum>
                    <isImport>true</isImport>
                    <type>1</type>
                    <width>4</width>
                </column>
            </Columns>
        </Sheet>
        <Sheet sheetName="殷楠测试2" sheetOrder="1" classPath="com.songtech.ypoi.test.testModel.TestModel2">
            <Columns>
                <column>
                    <colName>双精度</colName>
                    <fieldName>aDouble</fieldName>
                    <isImport>true</isImport>
                </column>
                <column>
                    <colName>高精度</colName>
                    <fieldName>bigDecimal</fieldName>
                    <isImport>true</isImport>
                </column>
                <column>
                    <colName>测试测试ccc</colName>
                    <fieldName>ceshi</fieldName>
                    <isImport>true</isImport>
                </column>
                <column>
                    <colName>时间</colName>
                    <fieldName>dateqqq</fieldName>
                    <exportFormatter>YYYY-MM-DD</exportFormatter>
                    <type>1</type>
                    <width>4</width>
                </column>
                <column>
                    <colName>随意字符串</colName>
                    <fieldName>ccc</fieldName>
                    <orderNum>4</orderNum>
                    <type>1</type>
                    <width>4</width>
                </column>
            </Columns>
        </Sheet>
        <!--&lt;!&ndash;必填样例&ndash;&gt;-->
        <!--<Sheet sheetName="required" sheetOrder="1">-->
            <!--<Titles>-->
                <!--<title>-->
                    <!--<titleName></titleName>-->
                <!--</title>-->
            <!--</Titles>-->
            <!--<Columns>-->
                <!--<column>-->
                    <!--<excelName></excelName>-->
                    <!--<colName></colName>-->
                <!--</column>-->
                <!--<column>-->
                    <!--<excelName></excelName>-->
                    <!--<colName></colName>-->
                <!--</column>-->
            <!--</Columns>-->
        <!--</Sheet>-->
    </Sheets>
</Excel>